{"assignments":[{"applicability":"conditional","authoring_action":"set_occurrence_pset","fact_key":"pset:Pset_WindowCommon.FireRating","operation_id":"set-window-fire-rating-1","ownership":"occurrence_direct","provenance":["request-source:user_request","request-evidence:window-request","operation:set-window-fire-rating-1","property-hash:sha256:917d0eb02cadaf6369eb5177d412158c56e6d400e1558efbc3edfeb82a0bdf49","source_fact_key:pset:Pset_WindowCommon.FireRating"],"source_fact_key":"pset:Pset_WindowCommon.FireRating","source_kind":"explicit_request","source_ref":"window-request","unit":null,"value":"EI60","value_type":"IfcLabel"}],"base_model_fingerprint":"sha256:707a032566dee8e969a44d95509be46d646440e2443624709f8d3ae2b45f4656","manifest_id":"semantic-manifest-495281d7d8604a6401a78d29","operation_id":"set-window-fire-rating-1","operation_type":"set_occurrence_properties","policy":{"policy_id":"occurrence.property.l2","policy_version":"0.1"},"schema_version":"text2ifc/ifc-repair-semantic-manifest/0.1"}
